{
  "runbook_version": 1,
  "id": "rb_9q4v7hn2xz",
  "where": "GitHub → Settings → Developer settings",
  "goal": "Accept the updated developer terms",
  "why_human": "Only the account owner can accept the terms.",
  "url": null,
  "lang": null,
  "values": {},
  "secrets": {},
  "steps": [
    {
      "text": "Read the terms and press Accept.",
      "url": null,
      "values": [],
      "warning": null,
      "annotations": []
    }
  ],
  "verify": null,
  "trust": "confirmed_by_user",
  "last_verified_at": "2026-09-07T11:04:00Z",
  "last_run_failed_at": null,
  "runs": 1,
  "created_at": "2026-09-07T11:04:00Z",
  "updated_at": "2026-09-07T11:04:00Z",
  "origin": {
    "app": "handoff-app",
    "app_version": "1.0.0"
  }
}
